<?xml version="1.0" encoding="UTF-8"?>
<travel xmlns="http://tempuri.org/flight"
 xmlns:xsi="http://www.w3.org/2001/XMLSchema-instance"
 xsi:schemaLocation="http://tempuri.org/flight file:/D:/MSC/Sem1/Web%20Data%20Management%20and%20XML/Project7/flight.xsd">
    <passenger ssn="ID001">
        <name>name0</name>
        <address>address0</address>
    </passenger>
    <passenger ssn="ID003">
        <name>name1</name>
        <address>address1</address>
    </passenger>
    <reservation passenger="ID002" flight="ID000">
        <creditcard>creditcard0</creditcard>
    </reservation>
    <flight id="ID005" from="ID005" to="ID002">
        <date>date0</date>
        <departureTime>departureTime0</departureTime>
        <arrivalTime>arrivalTime0</arrivalTime>
    </flight>
    <airport code="ID007">
        <name>name2</name>
    </airport>
</travel>
